word,furigana,translation,description,example,example_translation,category,level
をはじめ、をはじめとする,,"starting with; including","Used to give a prominent example when listing several things.","東京をはじめ、大阪や名古屋などの大都市。","Major cities, starting with Tokyo, such as Osaka and Nagoya.",expression,n2
をめぐって、をめぐる,,"concerning; over","Used when there is a controversy or discussion surrounding a specific topic.","環境問題をめぐって、熱心な討論が行われた。","A heated discussion took place concerning environmental issues.",expression,n2
をもとに、をもとにして,,"based on","Indicates that something is used as a foundation or source material.","実際にあった話をもとに小説を書いた。","I wrote a novel based on a true story.",expression,n2
んばかりに、んばかりだ,,"as if about to","Indicates that someone or something appears to be on the verge of doing something.","彼は泣かんばかりの顔で頼んできた。","He asked me with a face that looked as if he was about to cry.",expression,n2
がたい,,"difficult to; hard to","A suffix attached to verbs to express something is psychologically or physically difficult to do. (Reiterated for completeness)","得がたい経験をした。","I had a hard-to-come-by experience.",suffix,n2
かねる,,"to be unable to; to find it difficult to","A formal expression indicating that the speaker finds it difficult to do something for psychological or practical reasons.","そのご意見には賛成しかねます。","I find it difficult to agree with that opinion.",verb,n2
かねない,,"might; could possibly","Expresses the possibility that something negative might happen.","そんなことを言えば、誤解を招きかねない。","If you say such a thing, it might lead to a misunderstanding.",expression,n2
っぽい,,"-ish; like; tending to","A casual suffix attached to nouns or verb stems to indicate a strong resemblance or tendency.","彼の説明は忘れっぽくて、わかりにくい。","His explanations tend to be forgetful and are hard to understand.",suffix,n2
っこない,,"no chance of; definitely not","A very casual and emphatic way to express that something is absolutely impossible.","今からじゃ、終わりっこないよ。","There's no way we'll finish if we start now.",expression,n2
ばよかった,,"I should have; I wish I had","Expresses regret about something that was or was not done in the past.","もっと勉強すればよかった。","I should have studied more.",expression,n2
ふりをする,,"to pretend to; to act as if","Means to pretend to be in a certain state or to be doing something.","彼は寝たふりをした。","He pretended to be asleep.",phrase,n2
やむを得ない,やむをえない,"unavoidable; cannot be helped","Describes a situation that is inevitable or beyond one's control.","中止はやむを得なかった。","The cancellation was unavoidable.",expression,n2
わけがない,,"there's no way that; it's impossible that","Expresses the speaker's strong conviction that something is absolutely impossible.","彼がそんなことをするわけがない。","There's no way he would do such a thing.",expression,n2
せいか,,"perhaps because of","Used to express an uncertain reason for a situation.","年のせいか、最近疲れやすい。","Perhaps because of my age, I get tired easily these days.",expression,n2
だけ,,"only; just; as much as","A particle that can limit a scope or, with a verb, imply 'to the extent that'.","できるだけ早く来てください。","Please come as soon as you can.",particle,n2
とか〜とか,,"... and ... among other things","Used to list examples in a casual manner.","休みの日は映画を見るとか、買い物をするとかして過ごす。","On my days off, I spend my time doing things like watching movies and shopping.",particle,n2
という,,"called; that","Used to define, name, or quote something.","山田という人から電話があった。","There was a call from a person named Yamada.",expression,n2
ても,,"even if","A concessive particle meaning 'even if'.","雨が降っても行きます。","I will go even if it rains.",particle,n2
こと,,"thing; matter; fact","A nominalizer that turns verbs and clauses into nouns.","大切なことは諦めないことだ。","The important thing is not to give up.",noun,n2
ところ,,"place; point; moment","Can indicate a point in time or a situation.","今帰ってきたところです。","I just got back.",noun,n2
ものの,,"although; but","Concedes a point stated in the first clause, but introduces a contrary outcome in the second. (Reiterated for completeness)","申し込んではみたものの、実際に行けるかどうかわからない。","Although I applied, I don't know if I can actually go.",conjunction,n2
上で,うえで,"after; upon","Indicates that the preceding action is a prerequisite for the following action.","よく考えた上で、決めてください。","Please decide after thinking it over carefully.",expression,n2
に反して,にはんして,"contrary to; against","Indicates that something is opposite to what was expected or stated.","予想に反して、結果は良かった。","Contrary to expectations, the result was good.",expression,n2
に基づいて,にもとづいて,"based on","Indicates that something is founded on or derived from a source.","実際の事件に基づいて書かれた小説。","A novel written based on an actual incident.",expression,n2
にわたる、にわたって,,"spanning; over","The attributive form of にわたって, used before a noun, indicating something extends over a range of time or space.","これは十年にわたる研究の成果だ。","This is the result of research spanning ten years.",expression,n2
に限らず,にかぎらず,"not only; not limited to","Indicates that something applies not just to one thing but to others as well.","この規則は学生に限らず、教員にも適用される。","This rule applies not only to students but also to the teaching staff.",expression,n2
に応じた,におうじた,"suited to; in accordance with","The attributive form of に応じて, used before a noun.","体力に応じた運動をすることが大切だ。","It is important to do exercise suited to your physical strength.",expression,n2
に沿った,にそった,"in line with; along","The attributive form of に沿って, used before a noun.","当初の計画に沿った進行。","Progress in line with the initial plan.",expression,n2
に対する,にたいする,"towards; regarding","The attributive form of に対して, used before a noun.","親に対する態度が悪い。","His attitude toward his parents is bad.",expression,n2
に関する,にかんする,"related to; concerning","The attributive form of に関して, used before a noun.","環境に関する問題を議論する。","To discuss problems related to the environment.",expression,n2
を込めて,をこめて,"filled with; with","Indicates that an action is done with a deep feeling or emotion.","愛を込めて、料理を作った。","I cooked with love.",expression,n2
を中心に,をちゅうしんに,"centered around; mainly","Indicates that something is the main focus.","この祭りは地域の神社を中心に行われる。","This festival is held centered around the local shrine.",expression,n2
を踏まえて,をふまえて,"based on; taking into account","Indicates that something is considered as a basis for a decision or action.","現在の状況を踏まえて、今後の方針を決める。","We will decide our future policy based on the current situation.",expression,n2
をものともせずに,,"undaunted by; in spite of","Expresses that someone proceeds without being discouraged by difficulties.","彼はけがをものともせずに、試合に出場した。","He played in the game, undaunted by his injury.",expression,n2
んがため、んがために,,"in order to; for the purpose of","A formal and literary way to express a strong purpose.","真実を知らんがため、調査を続ける。","I will continue the investigation in order to know the truth.",expression,n2
あっての,,"which can exist only because of","Emphasizes that the existence of one thing is the necessary foundation for another.","お客様あっての商売です。","This business exists only because of our customers.",expression,n2
いかんで、いかんによって,,"depending on","A formal expression indicating that the outcome is determined by something else.","努力いかんで結果は変わる。","The result will change depending on your effort.",expression,n2
いかんによらず、いかんにかかわらず,,"regardless of","A formal expression meaning that something is not affected by a certain condition.","理由のいかんによらず、欠席は認めない。","Regardless of the reason, absence is not permitted.",expression,n2
だの〜だの,,"and... and so on (with a complaining nuance)","Used to list examples, often with a negative connotation of complaint.","寂しいだの暇だのと文句ばかり言う。","He does nothing but complain, saying things like he's lonely and he's bored.",particle,n2
であれ〜であれ,,"whether... or","A formal expression used to present alternatives, all of which lead to the same conclusion.","男であれ女であれ、機会は平等であるべきだ。","Whether you are a man or a woman, opportunities should be equal.",expression,n2
てからというもの,,"ever since","Emphasizes that a significant change occurred after a specific event and has continued.","彼が転勤してからというもの、会社が寂しくなった。","Ever since he was transferred, the office has felt lonely.",expression,n2
てしょうがない、てしかたがない,,"extremely; can't help but feel","Expresses an uncontrollable feeling or state.","彼女に会えなくて寂しくてしょうがない。","I can't see her and I'm so lonely I can't stand it.",expression,n2
に越したことはない,にこしたことはない,"it's best to; nothing is better than","Expresses that a certain action or state is the best possible choice.","できるなら、安全に越したことはない。","If possible, it's best to be safe.",expression,n2
もさることながら,,"not only... but also","Acknowledges the first point, then emphasizes a more important point.","技術もさることながら、アイデアが素晴らしい。","The technique is one thing, but the idea is also wonderful.",expression,n2